<?xml version="1.0" encoding="UTF-8"?>
<contact-lists
xmlns:xsi="http://www.w3.org/2001/XMLSchema-instance"
xsi:schemaLocation="http://www.slieer.com/abc contact-list.xsd">
	
	<ab></ab>
	<contact msisdn=" 13823322278">
		<name>Bill Doe</name>
	</contact>
	<list name="friends">
		<contact msisdn="joe@example.com">
			<name>Joe Smith</name>
		</contact>
		<contact msisdn="nancy@example.com">
			<name>Nancy Gross</name>
		</contact>
	</list>
</contact-lists>